{
  "$schema": "https://json-schema.org/draft/2020-12/schema",
  "$id": "https://github.com/marcmalerei/gluon/blob/main/release/recovery-manifest.schema.json",
  "title": "Gluon immutable release recovery manifest",
  "type": "object",
  "additionalProperties": false,
  "allOf": [
    {
      "if": {
        "properties": {
          "failureCategory": { "const": "published-registry-type-verification-storybook" }
        },
        "required": ["failureCategory"]
      },
      "then": { "required": ["previousRecoveryTag"] },
      "else": { "not": { "required": ["previousRecoveryTag"] } }
    }
  ],
  "required": [
    "schemaVersion",
    "releaseVersion",
    "canonicalTag",
    "canonicalTagCommit",
    "canonicalTagTree",
    "failedTestedCommit",
    "failedEvidenceCommit",
    "failedRunUrl",
    "failureCategory",
    "recoveryTag",
    "allowedCanonicalDeltaPaths"
  ],
  "properties": {
    "$schema": { "type": "string" },
    "schemaVersion": { "const": 1 },
    "releaseVersion": { "type": "string", "pattern": "^[1-9][0-9]*\\.[0-9]+\\.[0-9]+$" },
    "canonicalTag": { "type": "string", "pattern": "^v[1-9][0-9]*\\.[0-9]+\\.[0-9]+$" },
    "canonicalTagCommit": { "type": "string", "pattern": "^[a-f0-9]{40}$" },
    "canonicalTagTree": { "type": "string", "pattern": "^[a-f0-9]{40}$" },
    "failedTestedCommit": { "type": "string", "pattern": "^[a-f0-9]{40}$" },
    "failedEvidenceCommit": { "type": "string", "pattern": "^[a-f0-9]{40}$" },
    "failedRunUrl": {
      "type": "string",
      "format": "uri",
      "pattern": "^https://github.com/marcmalerei/gluon/actions/runs/[0-9]+$"
    },
    "failureCategory": {
      "enum": [
        "squash-merge-tested-commit-not-ancestor",
        "missing-bootstrap-record",
        "release-tag-version-resolution-shell",
        "release-performance-evidence-contract",
        "published-registry-type-verification-storybook"
      ]
    },
    "previousRecoveryTag": {
      "type": "string",
      "pattern": "^v[1-9][0-9]*\\.[0-9]+\\.[0-9]+-recovery\\.[1-9][0-9]*$"
    },
    "recoveryTag": {
      "type": "string",
      "pattern": "^v[1-9][0-9]*\\.[0-9]+\\.[0-9]+-recovery\\.[1-9][0-9]*$"
    },
    "allowedCanonicalDeltaPaths": {
      "type": "array",
      "minItems": 1,
      "uniqueItems": true,
      "items": { "type": "string", "minLength": 1 }
    }
  }
}
