{
  "$schema": "../recovery-manifest.schema.json",
  "schemaVersion": 1,
  "releaseVersion": "1.7.0",
  "canonicalTag": "v1.7.0",
  "canonicalTagCommit": "971b370dd24114c9c57089c02412545e5eec5235",
  "canonicalTagTree": "40fbe823e0238448d9aafa6ac5660bf69321acb6",
  "failedTestedCommit": "9c0c8fd9dad863d9520d38497fc05fee25ace791",
  "failedEvidenceCommit": "b9d15afe6edb72a38b14cc03e84dadd149a65940",
  "failedRunUrl": "https://github.com/marcmalerei/gluon/actions/runs/31166405472",
  "failureCategory": "published-registry-type-verification-storybook",
  "previousRecoveryTag": "v1.7.0-recovery.1",
  "recoveryTag": "v1.7.0-recovery.2",
  "allowedCanonicalDeltaPaths": [
    ".github/workflows/release.yml",
    "docs-site/content/1.7.0/guides/releasing/index.md",
    "docs/releasing.md",
    "release/compatibility/1.7.0.json",
    "release/evidence/1.7.0.json",
    "release/recovery-manifest.schema.json",
    "release/recovery/1.7.0.json",
    "scripts/publish-release.mjs",
    "scripts/validate-release-contract.mjs",
    "scripts/validate-release-recovery.mjs",
    "scripts/verify-registry-release.mjs",
    "scripts/verify-release-hosting.mjs"
  ]
}
